newsId,title,summary,link
6104773,福特宣布20億美元投資計畫 2027年推出平價電動皮卡,據《CNBC》周一 (11 日) 報導，福特汽車 (F-US) 宣布投資 20 億美元於肯塔基州路易斯維爾組裝廠，專門生產平價電動車。加上先前規劃的密西根州電池廠 30 億美元投資，將創造或保障近 4000 個就業機會。,https://m.cnyes.com/news/id/6104773
6104711,從電池到稀土 川普關稅戰如何改寫美國綠能未來？,根據《彭博》周一 (11 日) 報導，隨著美中關稅休戰協議的時限 (8 月 12 日) 逼近，太平洋兩岸的企業都屏息以待。專家指出，美國總統川普若對中國祭出「對等關稅」，將重創中國出口商，同時也會進一步打擊本已陷入困境的美國氣候科技產業,https://m.cnyes.com/news/id/6104711
6102767,一表掌握13家金控獲利！前7月合賺2764億元 這4家逆勢成長,台新新光金控於 7/24 正式合併，14 家上市金控縮減為 13 家，7 月自結獲利全數出爐，隨著新台幣匯率回穩，加上股息入帳、資本利得挹注,https://m.cnyes.com/news/id/6102767
6104758,軟銀大動作！傳日本行動支付公司PayPay赴美IPO 最快第四季登場,《路透》周一 (11 日) 援引知情人士消息報導，日本支付應用程式營運商 PayPay 的主要股東軟銀集團 (SoftBank) 已選定承銷團隊，籌備赴美首次公開發行股票(IPO)，集資規模可能超過 20 億美元，最快於今年第四季啟動。,https://m.cnyes.com/news/id/6104758
6104753,轟川普「拙劣霸凌」！創投大咖挺陳立武 籲英特爾展現骨氣,《CNBC》周一 (11 日) 報導，英國《金融時報》(FT)日前刊登知名創投人士莫里茲 (Mike Moritz) 的專欄，呼籲英特爾 (Intel) 董事會支持執行長陳立武(Lip-Bu Tan)，並批評美國總統川普上周要求其辭職,https://m.cnyes.com/news/id/6104753
