newsId,title,summary,link
6101791,回歸基本面 法人看台股Q3主流題材不變、Q4留意電子需求變化,美國總統川普宣布輸美半導體課徵 100% 關稅，不過，在美設廠或正在設廠者可豁免，支撐市場正面情緒，大盤站穩 24000 點之上。,https://m.cnyes.com/news/id/6101791
6101809,關稅不只20% 吳嘉隆：台灣未能掌握「交易型外交」 應主動大膽「開價」,台灣與美國的關稅談判進展緩慢，引發朝野各界關注。財經專家吳嘉隆昨（9）日接受華視節目專訪指出，台美關稅「卡關」主因在於，台灣未能掌握川普政府的談判邏輯與價值取向。他建議，台灣應主動出擊甚至大膽向美方「開價」，如用台積電擴,https://m.cnyes.com/news/id/6101809
6101741,既有關稅疊加20% 工商協進會提四點建議籲政府儘速說明釐清關鍵資訊,外界關注美國對台灣對等關稅是否為疊加處理，行政院經貿談判辦公室今 (9) 日證實，除了歐盟以外，各國關稅皆採疊加計算，台灣是既有稅率再加 20% 暫時性關稅稅率。對此，工商協進會今 (9) 日表示，政府需公開說明。,https://m.cnyes.com/news/id/6101741
6101768,〈熱門股〉全訊成交擴量周漲10.93％ 受惠軍工、航太展題材搶先發酵,"國防部即將採購近 5 萬架無人機及 9 月台北航太展登場。激勵全訊 (5222-TW) 本周成交量較前周增 3 倍近 9,000 張，周漲 10.93％，以 137 元作收，站上所有均線。",https://m.cnyes.com/news/id/6101768
6061859,歐洲電信市場復甦 逐步汰換華為設備 台灣網通廠突圍美國關稅壁壘,面對美國關稅威脅，全球貿易受影響，不過隨著歐洲電信市場復甦，以及逐漸汰換中國網通設備，台灣網通廠積極搶進歐洲商機。智易取得德國電信固網標案，訂單能見度上看 2026 年上半年，合勤控成功打入數家歐洲一級電信營運商，友訊則通過,https://m.cnyes.com/news/id/6061859
6099630,晶圓廠赴美擴建，帶動高純化學品槽車需求：上品,,https://m.cnyes.com/news/id/6099630
6101752,21兆！蘋果十年回購花的錢夠買下全球前13大公司以外任一間公司 專家卻疾呼做「這件事」,,https://m.cnyes.com/news/id/6101752
